{
  "artifact_type": "yearly-evidence-pack",
  "claims": [
    {
      "claim_id": "CLM-2026-W21-SUMMARY",
      "claim_type": "summary",
      "source_id": "SRC-2026-W21",
      "status": "resolved",
      "text": "Week 21 shows real demand for agent infrastructure, but the trend data still lacks the baseline needed to separate momentum from popularity."
    },
    {
      "claim_id": "CLM-2026-W21-SIGNAL",
      "claim_type": "signal",
      "source_id": "SRC-2026-W21",
      "status": "resolved",
      "text": "The durable signal is the shift from general AI enthusiasm toward operational tooling. The top shared topics \u2014 **python**, **ai**, **llm**, **typescript**, **nodejs**, and **javascript** \u2014 reinforce that the center of gravity is still developer-facing AI, but the better projects are focused on workflow reliability, packaging, and execution discipline. This is a healthier pattern than pure demo-driven hype because it implies the ecosystem is starting to care about how agent systems are run, maintained, and trusted."
    },
    {
      "claim_id": "CLM-2026-W21-NOISE",
      "claim_type": "noise",
      "source_id": "SRC-2026-W21",
      "status": "resolved",
      "text": "The weak signal is the amount of off-mission and exploit-heavy material that still clears the crawler. Security appears often, but too much of that volume is bypass, exploit, or cheat-oriented rather than defensive engineering. There is also obvious repetition in the agent category: many launches gesture at automation without much evidence of differentiation. That means the week is loud, but not all of that loudness deserves equal editorial weight."
    },
    {
      "claim_id": "CLM-2026-W21-GAPS",
      "claim_type": "gaps",
      "source_id": "SRC-2026-W21",
      "status": "resolved",
      "text": "The biggest missing piece is trustworthy momentum data. Without historical star snapshots, the analyzer cannot distinguish what is newly accelerating from what is simply already famous. The second gap is stronger quality filtering: exploit repositories, cheat tooling, and other off-mission projects still distort the weekly picture. The third is ecosystem balance. There is plenty of heat around AI builders, but much less visible energy around defensive security tooling, testing infrastructure for agents, and pragmatic maintenance tools that help teams run these systems safely at scale."
    },
    {
      "claim_id": "CLM-2026-W21-CONCLUSION",
      "claim_type": "conclusion",
      "source_id": "SRC-2026-W21",
      "status": "resolved",
      "text": "Week 21 matters because it shows where the GitHub conversation is maturing: away from generic AI excitement and toward tooling that makes agent workflows usable. But it also shows why the analyzer contract has to be strict. Until the pipeline has real trend baselines and better filtering, the right editorial stance is confident about the signal, skeptical about the noise, and explicit about the gaps."
    },
    {
      "claim_id": "CLM-2026-W22-SUMMARY",
      "claim_type": "summary",
      "source_id": "SRC-2026-W22",
      "status": "resolved",
      "text": "Week 22 delivers the clearest defensive-security signal of the year alongside a crystallising agent-skills economy \u2014 both nearly buried under the most concentrated coordinated star-farming campaign the crawl has caught."
    },
    {
      "claim_id": "CLM-2026-W22-SIGNAL",
      "claim_type": "signal",
      "source_id": "SRC-2026-W22",
      "status": "resolved",
      "text": "The durable signal this week is concentrated and coherent across four categories: defensive security tooling ([perplexityai/bumblebee](https://github.com/perplexityai/bumblebee), [apple/corecrypto](https://github.com/apple/corecrypto)), agent skills as distribution mechanism ([open-gsd/get-shit-done-redux](https://github.com/open-gsd/get-shit-done-redux), [aref-vc/tufte-claude-skill](https://github.com/aref-vc/tufte-claude-skill), [kingbootoshi/directional-prompting](https://github.com/kingbootoshi/directional-prompting)), memory and observability as infrastructure ([akitaonrails/ai-memory](https://github.com/akitaonrails/ai-memory), [NanoFlow-io/engram](https://github.com/NanoFlow-io/engram), [jianshuo/ccglass](https://github.com/jianshuo/ccglass)), and model routing/standards ([0xSero/codex-shim](https://github.com/0xSero/codex-shim), [workos/auth.md](https://github.com/workos/auth.md)). Each cluster has the hallmarks of real ecosystem movement: multiple independent teams, specific problem statements, non-zero fork activity. MoonshotAI's entry with [MoonshotAI/kimi-code](https://github.com/MoonshotAI/kimi-code) (343 \u2b50) also registers as a geopolitical signal \u2014 a Chinese AI lab making a direct public bid for the coding-agent space is worth tracking regardless of the repo's current depth. The noise this week is not background hum \u2014 it is an active manipulation campaign. The 421\u2013429 star cluster is unambiguous coordination: identical star counts, zero forks, creation timestamps within minutes of each other, heterogeneous content (emulators, unlockers, hack clients) mixed with Claude-branded repos using the same technique. Polymarket trading bots with copy-paste, keyword-stuffed descriptions represent a separate spam vector. Stars_gained data remained absent for trending repos, so the trending list continues to function as a popularity catalog rather than a momentum leaderboard \u2014 the caveat from W21 persists. The temptation to read the `claude-code: 19` topic count in signals as agent-ecosystem momentum should be resisted: a significant share of that count comes from the spam cluster using Claude branding, not from genuine tooling."
    },
    {
      "claim_id": "CLM-2026-W22-GAPS",
      "claim_type": "gaps",
      "source_id": "SRC-2026-W22",
      "status": "resolved",
      "text": "The most consequential gap is agent execution security. [nkzw-tech/cloudsail](https://github.com/nkzw-tech/cloudsail) (90 \u2b50) is the week's sole attempt at self-hosted agent sandboxing on Cloudflare, but it is isolated and under-resourced relative to the problem. As coding agents are routinely granted shell access, filesystem permissions, and API credentials, the blast radius of an agent error or compromise is expanding rapidly. There is no emergent category of runtime permission scoping, agent isolation, or behavioral boundary enforcement in this week's data \u2014 and no press narrative drawing attention to the gap. [scheidydude/codeindex](https://github.com/scheidydude/codeindex) (158 \u2b50) hints at blast-radius analysis for AI-assisted development but is an analysis tool, not a runtime control. The second gap is agent behavior testing. There is no shortage of tools to help agents write code, route to models, or persist memory. There is almost nothing in this week's crawl for verifying that agent actions are correct, bounded, and reproducible under varying inputs. Until agent behavior testing becomes a first-class category, production reliability claims for agent-built systems will remain assertions rather than verifiable properties."
    },
    {
      "claim_id": "CLM-2026-W22-CONCLUSION",
      "claim_type": "conclusion",
      "source_id": "SRC-2026-W22",
      "status": "resolved",
      "text": "The skills and memory infrastructure trends are in active acceleration and unlikely to peak next week. Watch for domain-specific skill packages proliferating on the model of [aref-vc/tufte-claude-skill](https://github.com/aref-vc/tufte-claude-skill), and for early integrations between the memory layer ([NanoFlow-io/engram](https://github.com/NanoFlow-io/engram), [MemPalace/mempalace](https://github.com/MemPalace/mempalace)) and the observability layer ([jianshuo/ccglass](https://github.com/jianshuo/ccglass)). The coordinated star-farming surge either subsides as GitHub responds or intensifies and forces a pipeline filtering upgrade \u2014 next week's data will be diagnostic. The BYOK routing and agent-protocol work initiated by [0xSero/codex-shim](https://github.com/0xSero/codex-shim) and [workos/auth.md](https://github.com/workos/auth.md) will attract fast-follower implementations if either gains traction in practitioner communities over the coming days."
    },
    {
      "claim_id": "CLM-2026-W23-SUMMARY",
      "claim_type": "summary",
      "source_id": "SRC-2026-W23",
      "status": "resolved",
      "text": "Week 23 amplifies two W22 trends \u2014 agent memory infrastructure and skills verticalization \u2014 while a suspicious 56k-star self-hosted AI workspace, a coordinated Russian censorship-bypass wave, and the heaviest offensive-security agent activity of the year reshape what noise looks like at scale."
    },
    {
      "claim_id": "CLM-2026-W23-SIGNAL",
      "claim_type": "signal",
      "source_id": "SRC-2026-W23",
      "status": "resolved",